stems,,,,,,,,,,,,,,,Q2-Bottleneck1-Title,Q2-Bottleneck1-Why,Q2.1-Bottleneck,Q2.1 Tags,Q2-Bottleneck2-Title,Q2-Bottleneck2-Why,Q2.2-Bottleneck,Q2.2 Tags,Q2-Bottleneck3-Title,Q2-Bottleneck3-Why,Q2.2-Bottleneck,Q2.3 Tags,Q3-Solution,Q3 Tags,Investment,,,,,,,,,,,,,,,,,,,,,,,,,,,,,,,,,,,,,,,,,,,,,,,,,,,,,,,,,,,,,,,,,,,,,,,,,,,,,,,,,,,,,,,,,,,,,,,,,,,,,,,,,,,,,,,,,,,,,,,,,,,,,,,,,,,,,,,,,,,,,,,,,,,,,,,,,,,,,,,,,,,,,,,,,,,,,,,,,,,,,,,,,,,,,,,,,,,,,,,,,,,,,,,,,,,,,,,,,,,,,,,,,,,,,,,,,,,,,,,,,,,,,,,,,,,,,,,,,,,,,,,,,,,,,,,,,,,,,,,,,,,,,,,,,,,,,,,,,,,,,,,,,,,,,,,,,,,,,,,,,,,,,,,,,,,,,,,,,,,,,,,,,,,,,,,,,,,,,,,,,,,,,,,,,,,,,,,,,,,,,,,,,,,,,,,,,,,,,,,,,,,,,,,,,,,,,,,,,,,,,,,,,,,,,,,,,,
1/14/2023 10:48,1/14/2023 10:50,68,173,FALSE,1/21/2023 10:51,R_3fTCiIXwPvVCnQR,,,gl,EN,"Yes, I consent",Principal investigator/Professor,,10-May,Funding ,,Bottleneck: Funding ,[F0] Overall Lack of Funding,Talent ,,Bottleneck: Talent ,"[H0] Lack of People
[+H0] More People
[H4] Top/Skilled Talent",Expertise ,,Bottleneck: Expertise ,[H4] Top/Skilled Talent,Funding ,[+F0] Overall More Funding,"Academic research (standard hypothesis driven science for publications),Big Data collection (large scale, empirical - ex multiomic biobanks)",,,,,,,"Calory restriction/dietary approaches,Genetic medicine (gene therapies/editing),Metformin supplementation,Microbiome replacement,NAD targeting therapies,Plasma/blood based therapies,Senolytics,Sirtuin targeting therapies,Stem cell therapies",,,,,,,,,,,,,,,,,,,,,,,,,,,,,,,,,,,,,,,,,,,,,,,,,,,,,,,,,,,,,,,,,,,,,,,,,,,,,,,,,,,,,,,,,,,,,,,,,,,,,,,,,,,,,,,,,,,,,,,,,,,,,,,,,,,,,,,,,,,,,,,,,,,,,,,,,,,,,,,,,,,,,,,,,,,,,,,,,,,,,,,,,,,,,,,,,,,,,,,,,,,,,,,,,,,,,,,,,,,,,,,,,,,,,,,,,,,,,,,,,,,,,,,,,,,,,,,,,,,,,,,,,,,,,,,,,,,,,,,,,,,,,,,,,,,,,,,,,,,,,,,,,,,,,,,,,,,,,,,,,,,,,,,,,,,,,,,,,,,,,,,,,,,,,,,,,,,,,,,,,,,,,,,,,,,,,,,,,,,,,,,,,,,,,,,,,,,,,,,,,,,,,,,,,,,,,,,,,,,,,,,,,,,
1/14/2023 11:07,1/14/2023 11:08,14,49,FALSE,1/21/2023 11:08,R_3irJMMIbuh7iQDR,,,gl,EN,"Yes, I consent",Principal investigator/Professor,,20-Oct,,,,,,,,,,,,,,,,,,,,,,,,,,,,,,,,,,,,,,,,,,,,,,,,,,,,,,,,,,,,,,,,,,,,,,,,,,,,,,,,,,,,,,,,,,,,,,,,,,,,,,,,,,,,,,,,,,,,,,,,,,,,,,,,,,,,,,,,,,,,,,,,,,,,,,,,,,,,,,,,,,,,,,,,,,,,,,,,,,,,,,,,,,,,,,,,,,,,,,,,,,,,,,,,,,,,,,,,,,,,,,,,,,,,,,,,,,,,,,,,,,,,,,,,,,,,,,,,,,,,,,,,,,,,,,,,,,,,,,,,,,,,,,,,,,,,,,,,,,,,,,,,,,,,,,,,,,,,,,,,,,,,,,,,,,,,,,,,,,,,,,,,,,,,,,,,,,,,,,,,,,,,,,,,,,,,,,,,,,,,,,,,,,,,,,,,,,,,,,,,,,,,,,,,,,,,,,,,,,,,,,,,,,,,,,,,,,,,,,,,,,,,,,,,,
1/14/2023 11:46,1/14/2023 11:46,5,23,FALSE,1/21/2023 11:46,R_2aWV7UF0H4S3wVf,,,gl,EN,"Yes, I consent",,,,,,,,,,,,,,,,,,,,,,,,,,,,,,,,,,,,,,,,,,,,,,,,,,,,,,,,,,,,,,,,,,,,,,,,,,,,,,,,,,,,,,,,,,,,,,,,,,,,,,,,,,,,,,,,,,,,,,,,,,,,,,,,,,,,,,,,,,,,,,,,,,,,,,,,,,,,,,,,,,,,,,,,,,,,,,,,,,,,,,,,,,,,,,,,,,,,,,,,,,,,,,,,,,,,,,,,,,,,,,,,,,,,,,,,,,,,,,,,,,,,,,,,,,,,,,,,,,,,,,,,,,,,,,,,,,,,,,,,,,,,,,,,,,,,,,,,,,,,,,,,,,,,,,,,,,,,,,,,,,,,,,,,,,,,,,,,,,,,,,,,,,,,,,,,,,,,,,,,,,,,,,,,,,,,,,,,,,,,,,,,,,,,,,,,,,,,,,,,,,,,,,,,,,,,,,,,,,,,,,,,,,,,,,,,,,,,,,,,,,,,,,,,,,,,
1/14/2023 13:49,1/14/2023 13:51,41,160,FALSE,1/21/2023 13:51,R_u33e7FmwcYdlNcJ,,,gl,EN,"Yes, I consent",Principal investigator/Professor,,20-Oct,Lack of reliable models,,Bottleneck: Lack of reliable models,"
[X1.1] Lack of Predictive Models",Length of the study,,Bottleneck: Length of the study,[X1.2] Slow & Expensive Models,Clinical trials for anti aging drugs,,Bottleneck: Clinical trials for anti aging drugs,"[T1] Lack of Regulatory Path
[+T1] Regulatory Path",Better model,"
[+X1.4] Unspecified/Misc Models","Academic research (standard hypothesis driven science for publications),Commercialization/Clinical translation (turning lab demonstrated interventions into therapies),Policy (governmental lobbying and policymaking on funding and healthcare changes to drive development of longevity interventions)",,,,,,,,,,,,,,,,,,,,,,,,,,,,,,,,,,,,,,,,,,,,,,,,,,,,,,,,,,,,,,,,,,,,,,,,,,,,,,,,,,,,,,,,,,,,,,,,,,,,,,,,,,,,,,,,,,,,,,,,,,,,,,,,,,,,,,,,,,,,,,,,,,,,,,,,,,,,,,,,,,,,,,,,,,,,,,,,,,,,,,,,,,,,,,,,,,,,,,,,,,,,,,,,,,,,,,,,,,,,,,,,,,,,,,,,,,,,,,,,,,,,,,,,,,,,,,,,,,,,,,,,,,,,,,,,,,,,,,,,,,,,,,,,,,,,,,,,,,,,,,,,,,,,,,,,,,,,,,,,,,,,,,,,,,,,,,,,,,,,,,,,,,,,,,,,,,,,,,,,,,,,,,,,,,,,,,,,,,,,,,,,,,,,,,,,,,,,,,,,,,,,,,,,,,,,,,,,,,,,,,,,,,,,,,,,,,
1/20/2023 16:37,1/21/2023 14:38,100,79264,TRUE,1/21/2023 14:38,R_3qkvt8DIjqceq1s,34.643,-86.8168,gl,EN,"Yes, I consent",Executive,,20-Oct,Too few explorational grant opportunities,Misalignment of incentives (+ see below),Bottleneck: Too few explorational grant opportunities <br>Why: Misalignment of incentives (+ see below),[F1] Too Conservative,Too few grants outside of NIH/NCI for non-traditional PIs. Leads to steep competition (I.e. Impetus virtually impossible to get),Space/vertical is small,Bottleneck: Too few grants outside of NIH/NCI for non-traditional PIs. Leads to steep competition (I.e. Impetus virtually impossible to get) <br>Why: Space/vertical is small,"[F5] Gated
[+F5] for Outsiders
[F0] Overall Lack of Funding",More radical and risky ideas (rejuvenation/reprogramming) are difficult to get funding for,"Public/financier perception, bias towards traditional biotech - even for longevity focused VCs","Bottleneck: More radical and risky ideas (rejuvenation/reprogramming) are difficult to get funding for <br>Why: Public/financier perception, bias towards traditional biotech - even for longevity focused VCs","[P2] Individual Disease Focus
[F1] Too Conservative",Small 20-75K exploratory grants for risky PoC work with favorable IP terms for builders.,[+F1] Ambitious/Exploratory,"Big Data collection (large scale, empirical - ex multiomic biobanks),Computational modeling (development of in silico aging models that can make useful predictions),Policy (governmental lobbying and policymaking on funding and healthcare changes to drive development of longevity interventions)",,"All important, #1-4 and 6 are critical! ",7,25,50,Until I'm no longer able to confer positive impacts on the world around me.,"Calory restriction/dietary approaches,Other 1 (specify),Other 2 (specify),Other 3 (specifiy)",Mitochondria,Metabolism (Energetic flux),"Evolutionary programing, antagonistic pleiotropy etc","Genetic medicine (gene therapies/editing),Organ replacement,Plasma/blood based therapies,Stem cell therapies",,,,,,,,,,,,,,,,,,,0,,,,0,0,,,,,0,,,,,,,,,,,,,,,,,,,10,,,,0,0,,,,,25,,,,,,,,,,,,,,,,,,,25,,,,50,25,,,,,50,,,,,,,,,,,,,,,,,,,3,,,,3,3,,,,,3,,,,,,,,,,,,,,,,,,,2,,,,3,2,,,,,2,,,,,,,,,,,,,,,,,,,2,,,,3,3,,,,,2,,,,,,,,,,,,,,,,,,,3,,,,3,3,,,,,2,,,,,,,,,,,,,,,,,,,3,,,,3,3,,,,,2,,,,,,,,0,0,0,5,,,,,,,,,,,,,,,,,,,5,10,5,10,,,,,,,,,,,,,,,,,,,10,25,10,25,,,,,,,,,,,,,,,,,,,2,1,2,1,,,,,,,,,,,,,,,,,,,1,2,2,1,,,,,,,,,,,,,,,,,,,1,2,2,1,,,,,,,,,,,,,,,,,,,2,3,2,1,,,,,,,,,,,,,,,,,,,2,2,2,1,,,,,,,,,,,,,,,,,,,Unknown,,Neutral,0,0,,,other
1/21/2023 14:32,1/21/2023 15:28,100,3316,TRUE,1/21/2023 15:28,R_1ogPMZzc1mRxcZu,34.0271,-118.5035,gl,EN,"Yes, I consent","Executive,Science communicator,Other (specify)",Life extension industry amplificator,10-May,"Not enough like-minded, capable and financially secured people in the industry (to work together)",It's always such a blast to meet such a person! All the work starts to move forward exponentially. We come across these people too seldom (but to be fair it's getting better every year). ,"Bottleneck: Not enough like-minded, capable and financially secured people in the industry (to work together) <br>Why: It's always such a blast to meet such a person! All the work starts to move forward exponentially. We come across these people too seldom (but to be fair it's getting better every year). ","[H0] Lack of People
[+H0] More People","The best life science now (not longevity in particular but biology/medicine/chemistry in general) is being done within unsuited (for life extension ideas) economical structures. Even if we stay within free market what would be the derivatives (financial instruments) in favor of life extension? What are the agents acting accordingly? As a result there is a scarcity of resources for our cause, people are fighting rather than collaborating. We only see human nature at its worse now.","I'm not sure I can fit it in one paragraph, it's a topic for the whole book.","Bottleneck: The best life science now (not longevity in particular but biology/medicine/chemistry in general) is being done within unsuited (for life extension ideas) economical structures. Even if we stay within free market what would be the derivatives (financial instruments) in favor of life extension? What are the agents acting accordingly? As a result there is a scarcity of resources for our cause, people are fighting rather than collaborating. We only see human nature at its worse now. <br>Why: I'm not sure I can fit it in one paragraph, it's a topic for the whole book.",[T5] Market Failure,Personal medical data access is over-protected and overall there's too much fuss and hysteria around it. People are only talking about its protection but not the harm that the lack of its disclosure is causing. ,"So many great projects in organized biohacking, self-organized clinical trials, data storage and share, human biomarkers research has stagnated. We could have had much needed open anonymized big clinical data already! As community-builders we too could have been using these platforms, they being great welcoming tool for the new people in the field.","Bottleneck: Personal medical data access is over-protected and overall there's too much fuss and hysteria around it. People are only talking about its protection but not the harm that the lack of its disclosure is causing.  <br>Why: So many great projects in organized biohacking, self-organized clinical trials, data storage and share, human biomarkers research has stagnated. We could have had much needed open anonymized big clinical data already! As community-builders we too could have been using these platforms, they being great welcoming tool for the new people in the field.","[T4] Misguided ""Bioethics""
[X12] Personal Health Data Sharing
[X2] Public Datasets
[C10] Siloing / Secrecy
[C1] Lack of Big Data Mindset","Some policy to disclose medical data (maybe oblige MDs to give the data to the patient in the end of each appointment would be sufficient, the patients could do the rest themselves). ","[+P3] Incentives
[+T8] Data Unlocking
[+X12] Health Data Platform","Big Data collection (large scale, empirical - ex multiomic biobanks),Outreach (building public support for longevity interventions),Policy (governmental lobbying and policymaking on funding and healthcare changes to drive development of longevity interventions)",,Technology development and Computational modeling are extremely important too and would probably benefit the industry the most in the nearest future. It's just these fields are doing pretty well and are not experiencing lack of funding.,0,5,30,As long as possible,,,,,,,,,,,,,,,,,,,,,,,,,,,,,,,,,,,,,,,,,,,,,,,,,,,,,,,,,,,,,,,,,,,,,,,,,,,,,,,,,,,,,,,,,,,,,,,,,,,,,,,,,,,,,,,,,,,,,,,,,,,,,,,,,,,,,,,,,,,,,,,,,,,,,,,,,,,,,,,,,,,,,,,,,,,,,,,,,,,,,,,,,,,,,,,,,,,,,,,,,,,,,,,,,,,,,,,,,,,,,,,,,,,,,,,,,,,,,,,,,,,,,,,,,,,,,,,,,,,,,,,,,,,,,,,,,,,,,,,,,,,,,,,,,,,,,,,,,,,,,,,,,,,,,,,,,,,,,,,,,,,,,,,,,,,,,,,,,,,,,,,,,,,,,,,,,,,,,,,,,,,,,,,,,,,,,,,,,,,,,,,,,,,,,,,,,,,,,,,,,,,,,,,,,,,,,,,,,,,,,,,,,,,,
1/14/2023 15:49,1/14/2023 15:53,68,289,FALSE,1/21/2023 15:53,R_2ru5xoVP8qNM1X0,,,gl,EN,"Yes, I consent",Principal investigator/Professor,,20-Oct,money,not enough money from NIA and it's hard to recruit/train/retain people (and do research),Bottleneck: money <br>Why: not enough money from NIA and it's hard to recruit/train/retain people (and do research),"[F2] for Basic Research
[+F2] for Basic Research",time,not enough time for research,Bottleneck: time <br>Why: not enough time for research,[H9] Personal/Misc,people,harder to recruit/retain people,Bottleneck: people <br>Why: harder to recruit/retain people,"[H0] Lack of People
[+H0] More People",funding agency,[+F0] Overall More Funding,"Academic research (standard hypothesis driven science for publications),Computational modeling (development of in silico aging models that can make useful predictions),Technology development (targeted solving of technological capability gaps)",,We still don't understand many of the key processes,2,5,10,100,"Calory restriction/dietary approaches,Genetic medicine (gene therapies/editing),Metformin supplementation,Microbiome replacement,Plasma/blood based therapies,Rapamycin supplementation,Senolytics,Somatic reprogramming,Stem cell therapies",,,,,,,,,,,,,,,,,,,,,,,,,,,,,,,,,,,,,,,,,,,,,,,,,,,,,,,,,,,,,,,,,,,,,,,,,,,,,,,,,,,,,,,,,,,,,,,,,,,,,,,,,,,,,,,,,,,,,,,,,,,,,,,,,,,,,,,,,,,,,,,,,,,,,,,,,,,,,,,,,,,,,,,,,,,,,,,,,,,,,,,,,,,,,,,,,,,,,,,,,,,,,,,,,,,,,,,,,,,,,,,,,,,,,,,,,,,,,,,,,,,,,,,,,,,,,,,,,,,,,,,,,,,,,,,,,,,,,,,,,,,,,,,,,,,,,,,,,,,,,,,,,,,,,,,,,,,,,,,,,,,,,,,,,,,,,,,,,,,,,,,,,,,,,,,,,,,,,,,,,,,,,,,,,,,,,,,,,,,,,,,,,,,,,,,,,,,,,,,,,,,,,,,,,,,,,,,,,,,,,,,,,,,
1/14/2023 18:47,1/14/2023 21:07,14,8388,FALSE,1/21/2023 21:07,R_2CH4mEgtcx3agT2,,,gl,EN,"Yes, I consent",Entrepreneur,,3-Jan,,,,,,,,,,,,,,,,,,,,,,,,,,,,,,,,,,,,,,,,,,,,,,,,,,,,,,,,,,,,,,,,,,,,,,,,,,,,,,,,,,,,,,,,,,,,,,,,,,,,,,,,,,,,,,,,,,,,,,,,,,,,,,,,,,,,,,,,,,,,,,,,,,,,,,,,,,,,,,,,,,,,,,,,,,,,,,,,,,,,,,,,,,,,,,,,,,,,,,,,,,,,,,,,,,,,,,,,,,,,,,,,,,,,,,,,,,,,,,,,,,,,,,,,,,,,,,,,,,,,,,,,,,,,,,,,,,,,,,,,,,,,,,,,,,,,,,,,,,,,,,,,,,,,,,,,,,,,,,,,,,,,,,,,,,,,,,,,,,,,,,,,,,,,,,,,,,,,,,,,,,,,,,,,,,,,,,,,,,,,,,,,,,,,,,,,,,,,,,,,,,,,,,,,,,,,,,,,,,,,,,,,,,,,,,,,,,,,,,,,,,,,,,,,,
1/22/2023 1:37,1/22/2023 1:52,100,867,TRUE,1/22/2023 1:52,R_wTrZ8FcrYy7rjyx,32.816,34.9821,gl,EN,"Yes, I consent",Entrepreneur,,<1,,,,,,,,,,,,,,,"Media (disseminating information),Outreach (building public support for longevity interventions),Policy (governmental lobbying and policymaking on funding and healthcare changes to drive development of longevity interventions)",,Currently all private investments are targeting high income individuals and this subject requires public attention today.on   ,2,5,10,120,"Calory restriction/dietary approaches,Microbiome replacement,Stem cell therapies",,,,"Genetic medicine (gene therapies/editing),Metformin supplementation,Somatic reprogramming,Telomere extending therapies",,,,,,,Affordable healthy life extension by lifestyle medicine is much more important than interventional medicine as ageing is a multi-throngs problem,,,,,,,,,,,,2,2,,,,,,,,2,,5,,,,,,,,,,,,,,,,,,10,6,,,,,,,,8,,10,,,,,,,,,,,,,,,,,,20,6,,,,,,,,12,,15,,,,,,,,,,,,,,,,,,1,1,,,,,,,,1,,1,,,,,,,,,,,,,,,,,,1,3,,,,,,,,1,,1,,,,,,,,,,,,,,,,,,1,3,,,,,,,,1,,1,,,,,,,,,,,,,,,,,,1,3,,,,,,,,1,,3,,,,,,,,,,,,,,,,,,3,3,,,,,,,,1,,1,,,,,,,,,,2,,,4,,,,,,,,5,,,,,,,,,,,4,,,6,,,,,,,,10,,,,,,,,,,,6,,,8,,,,,,,,15,,,,,,,,,,,1,,,1,,,,,,,,3,,,,,,,,,,,3,,,3,,,,,,,,3,,,,,,,,,,,3,,,3,,,,,,,,3,,,,,,,,,,,2,,,1,,,,,,,,3,,,,,,,,,,,3,,,3,,,,,,,,3,,,,,,,,,,,,,,,
1/14/2023 12:28,1/15/2023 2:57,14,52161,FALSE,1/22/2023 2:57,R_3h6BnoC0wcSjMSb,,,gl,EN,"Yes, I consent","Academic researcher (postdoc/PhD/MSc/BSc student),Entrepreneur",,3-Jan,,,,,,,,,,,,,,,,,,,,,,,,,,,,,,,,,,,,,,,,,,,,,,,,,,,,,,,,,,,,,,,,,,,,,,,,,,,,,,,,,,,,,,,,,,,,,,,,,,,,,,,,,,,,,,,,,,,,,,,,,,,,,,,,,,,,,,,,,,,,,,,,,,,,,,,,,,,,,,,,,,,,,,,,,,,,,,,,,,,,,,,,,,,,,,,,,,,,,,,,,,,,,,,,,,,,,,,,,,,,,,,,,,,,,,,,,,,,,,,,,,,,,,,,,,,,,,,,,,,,,,,,,,,,,,,,,,,,,,,,,,,,,,,,,,,,,,,,,,,,,,,,,,,,,,,,,,,,,,,,,,,,,,,,,,,,,,,,,,,,,,,,,,,,,,,,,,,,,,,,,,,,,,,,,,,,,,,,,,,,,,,,,,,,,,,,,,,,,,,,,,,,,,,,,,,,,,,,,,,,,,,,,,,,,,,,,,,,,,,,,,,,,,,,,
1/15/2023 8:33,1/15/2023 8:39,23,401,FALSE,1/22/2023 8:39,R_eRqm5vwL82PQPER,,,gl,EN,"Yes, I consent",Academic researcher (postdoc/PhD/MSc/BSc student),,>20,,,,,,,,,,,,,,,,,,,,,,,,,,,,,,,,,,,,,,,,,,,,,,,,,,,,,,,,,,,,,,,,,,,,,,,,,,,,,,,,,,,,,,,,,,,,,,,,,,,,,,,,,,,,,,,,,,,,,,,,,,,,,,,,,,,,,,,,,,,,,,,,,,,,,,,,,,,,,,,,,,,,,,,,,,,,,,,,,,,,,,,,,,,,,,,,,,,,,,,,,,,,,,,,,,,,,,,,,,,,,,,,,,,,,,,,,,,,,,,,,,,,,,,,,,,,,,,,,,,,,,,,,,,,,,,,,,,,,,,,,,,,,,,,,,,,,,,,,,,,,,,,,,,,,,,,,,,,,,,,,,,,,,,,,,,,,,,,,,,,,,,,,,,,,,,,,,,,,,,,,,,,,,,,,,,,,,,,,,,,,,,,,,,,,,,,,,,,,,,,,,,,,,,,,,,,,,,,,,,,,,,,,,,,,,,,,,,,,,,,,,,,,,,,,
1/15/2023 9:18,1/15/2023 12:53,5,12851,FALSE,1/22/2023 12:53,R_1j87xVAXwwsJOjm,,,gl,EN,"Yes, I consent",,,,,,,,,,,,,,,,,,,,,,,,,,,,,,,,,,,,,,,,,,,,,,,,,,,,,,,,,,,,,,,,,,,,,,,,,,,,,,,,,,,,,,,,,,,,,,,,,,,,,,,,,,,,,,,,,,,,,,,,,,,,,,,,,,,,,,,,,,,,,,,,,,,,,,,,,,,,,,,,,,,,,,,,,,,,,,,,,,,,,,,,,,,,,,,,,,,,,,,,,,,,,,,,,,,,,,,,,,,,,,,,,,,,,,,,,,,,,,,,,,,,,,,,,,,,,,,,,,,,,,,,,,,,,,,,,,,,,,,,,,,,,,,,,,,,,,,,,,,,,,,,,,,,,,,,,,,,,,,,,,,,,,,,,,,,,,,,,,,,,,,,,,,,,,,,,,,,,,,,,,,,,,,,,,,,,,,,,,,,,,,,,,,,,,,,,,,,,,,,,,,,,,,,,,,,,,,,,,,,,,,,,,,,,,,,,,,,,,,,,,,,,,,,,,,,
1/22/2023 18:41,1/22/2023 18:47,100,341,TRUE,1/22/2023 18:47,R_1E0RthzETwnAXuV,32.9661,-117.1202,gl,EN,"Yes, I consent",Entrepreneur,,10-May,Team,,Bottleneck: Team,[H7] Hiring,Studies completed,"A lot of studies depend on time. For now, we have a limited number of studies, and it takes time to have more.","Bottleneck: Studies completed <br>Why: A lot of studies depend on time. For now, we have a limited number of studies, and it takes time to have more.","
[X1.2] Slow & Expensive Models",,,,,Beta testers of our technology,"[+T2] Participant Database
[+X12] Health Data Platform","Big Data collection (large scale, empirical - ex multiomic biobanks),Commercialization/Clinical translation (turning lab demonstrated interventions into therapies),Technology development (targeted solving of technological capability gaps)",,,5,8,20,Until I'll be bored =),"Calory restriction/dietary approaches,Metformin supplementation,Rapamycin supplementation,Senolytics,Telomere extending therapies",,,,"Genetic medicine (gene therapies/editing),NAD targeting therapies,Organ replacement",,,,,,,,,,,,,,,,,,,5,,,5,5,,,,,,,,,,,,,,,,,,,,,,,,,5,,,5,10,,,,,,,,,,,,,,,,,,,,,,,,,5,,,5,15,,,,,,,,,,,,,,,,,,,,,,,,,3,,,3,3,,,,,,,,,,,,,,,,,,,,,,,,,3,,,3,3,,,,,,,,,,,,,,,,,,,,,,,,,3,,,3,3,,,,,,,,,,,,,,,,,,,,,,,,,3,,,3,3,,,,,,,,,,,,,,,,,,,,,,,,,3,,,3,3,,,,,,,,,,,,,,,,,2,,3,,,,,5,10,,,,8,,,,,,,,,,3,,4,,,,,10,10,,,,12,,,,,,,,,,3,,5,,,,,12,10,,,,16,,,,,,,,,,2,,2,,,,,2,2,,,,2,,,,,,,,,,2,,3,,,,,3,3,,,,3,,,,,,,,,,3,,3,,,,,3,3,,,,3,,,,,,,,,,3,,3,,,,,3,3,,,,3,,,,,,,,,,2,,2,,,,,2,2,,,,2,,,,,,,,,,,,,,
1/14/2023 13:22,1/23/2023 0:50,100,732460,TRUE,1/23/2023 0:50,R_1Q3XNB3QtXPaMQE,37.5549,-122.2708,gl,EN,"Yes, I consent","Entrepreneur,Executive",,3-Jan,,,,,,,,,,,,,regulatory policy change recognizing aging is a disease,"[T1] Lack of Regulatory Path
[+T1] Regulatory Path","Policy (governmental lobbying and policymaking on funding and healthcare changes to drive development of longevity interventions),Regulatory reform (shifting the FDA to an aging/longevity paradigm),Technology development (targeted solving of technological capability gaps)",,,1,10,30,200,,,,,"Organ replacement,Rapamycin supplementation,Senolytics,Somatic reprogramming",,,,,,,,,,,,,,,,,,,,,,,10,,5,5,,5,,,,,,,,,,,,,,,,,,,,,,,,20,,10,10,,10,,,,,,,,,,,,,,,,,,,,,,,,80,,15,20,,60,,,,,,,,,,,,,,,,,,,,,,,,3,,2,3,,3,,,,,,,,,,,,,,,,,,,,,,,,2,,1,3,,2,,,,,,,,,,,,,,,,,,,,,,,,3,,1,3,,2,,,,,,,,,,,,,,,,,,,,,,,,3,,2,2,,1,,,,,,,,,,,,,,,,,,,,,,,,1,,1,2,,2,,,,,,,,,,,,,,,,,,,,,,,,,,,,,,,,,,,,,,,,,,,,,,,,,,,,,,,,,,,,,,,,,,,,,,,,,,,,,,,,,,,,,,,,,,,,,,,,,,,,,,,,,,,,,,,,,,,,,,,,,,,,,,,,,,,,,,,,,,,,,,,,,,,,,,,,,,,,,,,,,,,,,,,,,,,,,,,,,,,,,,,,,,,,,,,,
1/16/2023 3:12,1/16/2023 3:14,14,65,FALSE,1/23/2023 3:14,R_1jrFuhzSbfb3mP5,,,gl,EN,"Yes, I consent",Academic researcher (postdoc/PhD/MSc/BSc student),,20-Oct,,,,,,,,,,,,,,,,,,,,,,,,,,,,,,,,,,,,,,,,,,,,,,,,,,,,,,,,,,,,,,,,,,,,,,,,,,,,,,,,,,,,,,,,,,,,,,,,,,,,,,,,,,,,,,,,,,,,,,,,,,,,,,,,,,,,,,,,,,,,,,,,,,,,,,,,,,,,,,,,,,,,,,,,,,,,,,,,,,,,,,,,,,,,,,,,,,,,,,,,,,,,,,,,,,,,,,,,,,,,,,,,,,,,,,,,,,,,,,,,,,,,,,,,,,,,,,,,,,,,,,,,,,,,,,,,,,,,,,,,,,,,,,,,,,,,,,,,,,,,,,,,,,,,,,,,,,,,,,,,,,,,,,,,,,,,,,,,,,,,,,,,,,,,,,,,,,,,,,,,,,,,,,,,,,,,,,,,,,,,,,,,,,,,,,,,,,,,,,,,,,,,,,,,,,,,,,,,,,,,,,,,,,,,,,,,,,,,,,,,,,,,,,,,,
1/23/2023 8:38,1/23/2023 10:15,100,5797,TRUE,1/23/2023 10:15,R_2VCPQTFPb5tJQoZ,42.3737,-71.1284,gl,EN,"Yes, I consent",Academic researcher (postdoc/PhD/MSc/BSc student),,10-May,Access to aged mice resources,"In the US, NIA colonies have limiited availability (usually prioritized for NIA-funded grantees).","Bottleneck: Access to aged mice resources <br>Why: In the US, NIA colonies have limiited availability (usually prioritized for NIA-funded grantees).","[X4] Aged Animals/Tissues
[+X5] Aged Animals/Tissue Bank",Somewhat of a stigmatism against focusing exclusively on extending maximum longevity in humans - with the more palatable 'healthspan' being offered as somewhat of a (in my opinion) compromise or buffer.,Not sure why exactly extending lifespan is seen as not a worthy goal of pursuit.,Bottleneck: Somewhat of a stigmatism against focusing exclusively on extending maximum longevity in humans - with the more palatable 'healthspan' being offered as somewhat of a (in my opinion) compromise or buffer. <br>Why: Not sure why exactly extending lifespan is seen as not a worthy goal of pursuit.,[P5] Geroscience Aversion,Lack of clinical trials with aging as a target outcome.,"Probably a lack of good biomarkers to measure aging phenotypes, possibly the fact that aging itself may not be strictly classified as a 'disease' to be treated.","Bottleneck: Lack of clinical trials with aging as a target outcome. <br>Why: Probably a lack of good biomarkers to measure aging phenotypes, possibly the fact that aging itself may not be strictly classified as a 'disease' to be treated.","[S1] Validated Biomarkers
[+S1] Validated Biomarkers
[T1] Lack of Regulatory Path
[P2] Individual Disease Focus","Aging being classified as a disease by the FDA and related bodies, to accelerate trials and encourage increased funding in the field of geroscience.",[+T1] Regulatory Path,"Academic research (standard hypothesis driven science for publications),Commercialization/Clinical translation (turning lab demonstrated interventions into therapies),Regulatory reform (shifting the FDA to an aging/longevity paradigm)",,,10,20,50,Why put a limit on this?,"Calory restriction/dietary approaches,Genetic medicine (gene therapies/editing),Senolytics",,,,"Plasma/blood based therapies,Somatic reprogramming",,,,,,,Great survey! Very thorough.,,,,,,,,,,,,,,,,,10,,,,10,,,,,,,,,,,,,,,,,,,,,,,,,20,,,,20,,,,,,,,,,,,,,,,,,,,,,,,,20,,,,20,,,,,,,,,,,,,,,,,,,,,,,,,3,,,,3,,,,,,,,,,,,,,,,,,,,,,,,,3,,,,2,,,,,,,,,,,,,,,,,,,,,,,,,2,,,,2,,,,,,,,,,,,,,,,,,,,,,,,,2,,,,2,,,,,,,,,,,,,,,,,,,,,,,,,3,,,,2,,,,,,,,,,,,0,0,,,,,,,10,,,,,,,,,,,,,,10,10,,,,,,,20,,,,,,,,,,,,,,20,50,,,,,,,50,,,,,,,,,,,,,,1,3,,,,,,,3,,,,,,,,,,,,,,1,2,,,,,,,2,,,,,,,,,,,,,,2,3,,,,,,,2,,,,,,,,,,,,,,1,1,,,,,,,2,,,,,,,,,,,,,,2,3,,,,,,,3,,,,,,,,,,,,,,,,,,
1/23/2023 11:24,1/23/2023 13:09,100,6298,TRUE,1/23/2023 13:09,R_2Yb3O40PUjpZMEo,38.1163,-122.5714,gl,EN,"Yes, I consent",Academic researcher (postdoc/PhD/MSc/BSc student),,5-Mar,biomarker for aging in mice,somewhere to send off tissue/blood to test if an intervention is working,Bottleneck: biomarker for aging in mice <br>Why: somewhere to send off tissue/blood to test if an intervention is working,"[S1] Validated Biomarkers
[+S1] Validated Biomarkers
[+C10] Outsourcing Services",access to human tissue,"expensive, time-consuming, limited tissue types, limited health data","Bottleneck: access to human tissue <br>Why: expensive, time-consuming, limited tissue types, limited health data",[X3] Human Samples,,,,,an easy-access human tissue biobank with health and multiomics data,"[+X4] Human Cell/Tissue Bank
[+X2] Public Datasets","Media (disseminating information),Policy (governmental lobbying and policymaking on funding and healthcare changes to drive development of longevity interventions),Technology development (targeted solving of technological capability gaps)",,"if drug delivery was improved we could do targeted therapies with lower side effects, which would make it more convincing to give a drug to someone who is aging but otherwise healthy. We also need to make targeting ""aging"" not seem crazy to the public eye",0,5,10,at this point indefinitely ,"Calory restriction/dietary approaches,Rapamycin supplementation,Senolytics",,,,No,,,,,,,,,,,,,,,,,,,,,,,,,,,,,,,,,,,,,,,,,,,,,,,,,,,,,,,,,,,,,,,,,,,,,,,,,,,,,,,,,,,,,,,,,,,,,,,,,,,,,,,,,,,,,,,,,,,,,,,,,,,,,,,,,,,,,,,,,,,,,,,,,,,,,,,,,,,,,,,,,,,,,,,,,,,,,,,,,,,,,,,,,,,,,,,,,,,,,,,,,,,,,,,,,,,,,,,,,,,,,,,,,,,,,,,,,,,,,,,,,,,3,,,,,,,5,0,,,,,,,,,,,,,,5,,,,,,,6,5,,,,,,,,,,,,,,7,,,,,,,7,5,,,,,,,,,,,,,,3,,,,,,,3,3,,,,,,,,,,,,,,1,,,,,,,2,2,,,,,,,,,,,,,,1,,,,,,,1,2,,,,,,,,,,,,,,1,,,,,,,1,2,,,,,,,,,,,,,,1,,,,,,,3,3,,,,,,,,,,,,,,,,,,
