stems,,,,,,,,,,,,,,,Q2-Bottleneck1-Title,Q2-Bottleneck1-Why,Q2.1-Bottleneck,Q2.1 Tags,Q2-Bottleneck2-Title,Q2-Bottleneck2-Why,Q2.2-Bottleneck,Q2.2 Tags,Q2-Bottleneck3-Title,Q2-Bottleneck3-Why,Q2.2-Bottleneck,Q2.3 Tags,Q3-Solution,Q3 Tags,Investment,,,,,,,,,,,,,,,,,,,,,,,,,,,,,,,,,,,,,,,,,,,,,,,,,,,,,,,,,,,,,,,,,,,,,,,,,,,,,,,,,,,,,,,,,,,,,,,,,,,,,,,,,,,,,,,,,,,,,,,,,,,,,,,,,,,,,,,,,,,,,,,,,,,,,,,,,,,,,,,,,,,,,,,,,,,,,,,,,,,,,,,,,,,,,,,,,,,,,,,,,,,,,,,,,,,,,,,,,,,,,,,,,,,,,,,,,,,,,,,,,,,,,,,,,,,,,,,,,,,,,,,,,,,,,,,,,,,,,,,,,,,,,,,,,,,,,,,,,,,,,,,,,,,,,,,,,,,,,,,,,,,,,,,,,,,,,,,,,,,,,,,,,,,,,,,,,,,,,,,,,,,,,,,,,,,,,,,,,,,,,,,,,,,,,,,,,,,,,,,,,,,,,,,,,,,,,,,,,,,,,,,,,,,,,,,,,,
10/29/2022 20:07,11/1/2022 13:07,75,234031,FALSE,11/8/2022 12:08,R_sM7OP1R73itpIEp,,,anonymous,EN,"Yes, I consent",Entrepreneur,,20-Oct,Cultural Aversion,,Bottleneck: Cultural Aversion,[P5] Geroscience Aversion,,,,,,,,,,,Technology development (targeted solving of technological capability gaps),,,,,,,Genetic medicine (gene therapies/editing),,,,,,,,,,,,,,,,,,,,,,,,,,,,,,,,,,,,,,,,,,,,,,,,,,,,,,,,,,,,,,,,,,,,,,,,,,,,,,,,,,,,,,,,,,,,,,,,,,,,,,,,,,,,,,,,,,,,,,,,,,,,,,,,,,,,,,,,,,,,,,,,,,,,,,,,,,,,,,,,,,,,,,,,,,,,,,,,,,,,,,,,,,,,,,,,,,,,,,,,,,,,,,,,,,,,,,,,,,,,,,,,,,,,,,,,,,,,,,,,,,,,,,,,,,,,,,,,,,,,,,,,,,,,,,,,,,,,,,,,,,,,,,,,,,,,,,,,,,,,,,,,,,,,,,,,,,,,,,,,,,,,,,,,,,,,s,,,,,,,,,,,,,,,,,,,,,s,,,,,,,,,,,,,,,,,,,,,,,,,,,,,,,,,,,,,,,,,,,,,,,,,,,,,,,,,,,,,,,,,,,,,,,,,,
11/1/2022 13:07,11/1/2022 13:24,36,1019,FALSE,11/8/2022 12:24,R_O81aMiBeeNLDYmB,,,anonymous,EN,"Yes, I consent",Entrepreneur,,20-Oct,Cultural sentiment,Longevity research is a niche where people feel like they can't say what their actual goals are. Causes people to work on the wrong things / inefficient paths.,Bottleneck: Cultural sentiment <br>Why: Longevity research is a niche where people feel like they can't say what their actual goals are. Causes people to work on the wrong things / inefficient paths.,"[P5] Geroscience Aversion
[P2] Individual Disease Focus
[P4] Unaligned Institutions",Outdated Healthcare System,We have a healthcare system designed in the 1800s that is reactionary to acute disease and the incentives are to maximize cost not health. We need an incentive structure that optimizes for health and lifespan via prevention of aging not treating the symptoms.,Bottleneck: Outdated Healthcare System <br>Why: We have a healthcare system designed in the 1800s that is reactionary to acute disease and the incentives are to maximize cost not health. We need an incentive structure that optimizes for health and lifespan via prevention of aging not treating the symptoms.,"[T5] Market Failure
[+P3] Incentives
[P2] Individual Disease Focus",Near-termism,"The majority of ""longevity"" work is attempts to find low hanging fruit that doesn't exist - current therapeutic stategies will mostly fail or have very little impact. A long-term mindset would but much more resources on technology development and more detailed characterization and modeling of aging.","Bottleneck: Near-termism <br>Why: The majority of ""longevity"" work is attempts to find low hanging fruit that doesn't exist - current therapeutic stategies will mostly fail or have very little impact. A long-term mindset would but much more resources on technology development and more detailed characterization and modeling of aging.","[C17] Short-termism
[+X0] Unspecified Tools/Tech",A culture of long-termism and optimism about maximizing human health and lifespan.,"[+C13] Long-termism
[+P2] Culture",,,,,,,,,,,,,,,,,,,,,,,,,,,,,,,,,,,,,,,,,,,,,,,,,,,,,,,,,,,,,,,,,,,,,,,,,,,,,,,,,,,,,,,,,,,,,,,,,,,,,,,,,,,,,,,,,,,,,,,,,,,,,,,,,,,,,,,,,,,,,,,,,,,,,,,,,,,,,,,,,,,,,,,,,,,,,,,,,,,,,,,,,,,,,,,,,,,,,,,,,,,,,,,,,,,,,,,,,,,,,,,,,,,,,,,,,,,,,,,,,,,,,,,,,,,,,,,,,,,,,,,,,,,,,,,,,,,,,,,,,,,,,,,,,,,,,,,,,,,,,,,,,,,,,,,,,,,,,,,,,,,,,,,,,,,,,,,,,,,,,,,,,,,,,,,,,,,,,,,,,,,,,,,,,,,,,,,,,,,,,,,,,,,,,,,,,,,,,,,,,,,,,,,,,,,,,,,,,,,,,,,,,,,,,,,,,,,
12/19/2022 11:34,12/20/2022 16:35,100,104442,TRUE,12/20/2022 16:35,R_2S6yCAcBHHsT6V6,43.7687,-79.4109,anonymous,EN,"Yes, I consent","Entrepreneur,Investor,Media",,3-Jan,Nation state levels of funding (100's of billions),"Apollo program was 250B + 400,000 people. Aging will likely take more resources","Bottleneck: Nation state levels of funding (100's of billions) <br>Why: Apollo program was 250B + 400,000 people. Aging will likely take more resources","[F0] Overall Lack of Funding
[+F0] Overall More Funding","Talent, and talent pipeline",Very few people know that you can work on aging. Biology of aging isn't included in standard curriculum in high school / college. ,"Bottleneck: Talent, and talent pipeline <br>Why: Very few people know that you can work on aging. Biology of aging isn't included in standard curriculum in high school / college. ","[H0] Lack of People
[+H0] More People
[H1] Career & Edu Paths
[+H3] Longevity Training",Perception,"The fact that the most funded seed startup in all of history could not reveal their financial backers suggests we need to do more to make funding longevity not just socially acceptable, but a moral imperative!","Bottleneck: Perception <br>Why: The fact that the most funded seed startup in all of history could not reveal their financial backers suggests we need to do more to make funding longevity not just socially acceptable, but a moral imperative!",[P5] Geroscience Aversion,Wide scale perception change --> that obviating aging is a moral imperative.,[+P2] Culture,"Media (disseminating information),Outreach (building public support for longevity interventions),Technology development (targeted solving of technological capability gaps)",,,3,5,20,Until I decide I want to die. Indefinitely.,Other 1 (specify),Investment,,,,,,,,,,,,,,,,,,,,,,,,,,,,,,,,,,,,,,,,,,,,,,,,,,,,,,,,,,,,,,,,,,,,,,,,,,,,,,,,,,,,,,,,,,,,,,,,,,,,,,,,,,,,,,,,,,,,,,,,,,,,,,,,,,,,,,,,,,,,,,,,,,,,,,,,,,,,,,,,,,,,,,,,,,,,,,,,,,,,,,,,,,,,,,,,,,,,,,,,,,,,,,,,,,,,,,,,,,,,,,,,,,,,,,,,,,,,,,,,,,,,,,,,,,,,,,,,,,,,,,,,,,,,,,,,,,,,,,,,,,,,,,,,,,,,,,,,,,,,,,,,,,,,,,,,,,,,,,,,,,,,,,,,,,,3,,,,,,,,,,,,,,,,,,,,,,,,,,,,,,,,,,,,,,,,,,,,,,,,,,,,,,,,,,,,,,,,,,3,,,,,,,,,,,,,,,,,,,,,,Unknown,,Neutral,0,0,,,other
12/23/2022 12:34,12/23/2022 12:44,100,560,TRUE,12/23/2022 12:44,R_1LoIzQtAURME9Ju,42.3513,-71.137,gl,EN,"Yes, I consent","Academic researcher (postdoc/PhD/MSc/BSc student),Entrepreneur",,20-Oct,Lack of inexpensive aged mice,,Bottleneck: Lack of inexpensive aged mice,"[X4] Aged Animals/Tissues
[+X5] Aged Animals/Tissue Bank",Lack of gene delivery tools to do whole-body genetic engineering,,Bottleneck: Lack of gene delivery tools to do whole-body genetic engineering,"[X8] Gene Delivery
[+X7] Gene Delivery",Labor required to perform physiological mouse assays,,Bottleneck: Labor required to perform physiological mouse assays,"[X6] Lab Automation
[+X5] Lab Automation",The ability to inexpensively outsource longevity studies to CROs.,[+C10] Outsourcing Services,"Policy (governmental lobbying and policymaking on funding and healthcare changes to drive development of longevity interventions),Regulatory reform (shifting the FDA to an aging/longevity paradigm)",,,2,7,20,Indefinitely,"Genetic medicine (gene therapies/editing),Plasma/blood based therapies,Telomere extending therapies",,,,"Calory restriction/dietary approaches,Metformin supplementation,Senolytics,Somatic reprogramming",,,,,,,,,,,,,,,,,,3,,3,,,,,,4,,1,,,,,,,,,,,,,,,,,,,5,,4,,,,,,8,,3,,,,,,,,,,,,,,,,,,,5,,4,,,,,,10,,12,,,,,,,,,,,,,,,,,,,2,,2,,,,,,2,,2,,,,,,,,,,,,,,,,,,,1,,2,,,,,,2,,1,,,,,,,,,,,,,,,,,,,1,,1,,,,,,1,,1,,,,,,,,,,,,,,,,,,,1,,1,,,,,,1,,1,,,,,,,,,,,,,,,,,,,1,,1,,,,,,1,,1,,,,,,,,,,,,,1,,,,,3,,,,,,0,,,,,,,,,,,6,,,,,7,,,,,,4,,,,,,,,,,,30,,,,,7,,,,,,4,,,,,,,,,,,2,,,,,2,,,,,,2,,,,,,,,,,,2,,,,,1,,,,,,3,,,,,,,,,,,3,,,,,2,,,,,,2,,,,,,,,,,,3,,,,,1,,,,,,2,,,,,,,,,,,2,,,,,1,,,,,,2,,,,,,,,,,,,,,
12/27/2022 7:36,12/27/2022 7:45,100,547,TRUE,12/27/2022 7:45,R_1rrcP549jo3F5df,32.0803,34.7805,gl,EN,"Yes, I consent","Entrepreneur,Investor",,3-Jan,Capital,very hard to do science without funding,Bottleneck: Capital <br>Why: very hard to do science without funding,"[F0] Overall Lack of Funding
[+F0] Overall More Funding",HR,very hard to do science without scientists,Bottleneck: HR <br>Why: very hard to do science without scientists,"[H0] Lack of People
[+H0] More People",Regulation,very hard to do science when many experiments are not allowed,Bottleneck: Regulation <br>Why: very hard to do science when many experiments are not allowed,"[T4] Misguided ""Bioethics""
[+T3] Regulatory Opt-Out 
[+T1] Regulatory Path",,,"Outreach (building public support for longevity interventions),Policy (governmental lobbying and policymaking on funding and healthcare changes to drive development of longevity interventions),Regulatory reform (shifting the FDA to an aging/longevity paradigm)",,We need more humans to care about this if we want to mobilize massive resources.,0,2,5,As long as possible,,,,,"Calory restriction/dietary approaches,Genetic medicine (gene therapies/editing),Microbiome replacement,NAD targeting therapies,Organ replacement,Plasma/blood based therapies,Rapamycin supplementation,Senolytics,Somatic reprogramming,Stem cell therapies",,,,,,,,,,,,,,,,,,1,1,,0,0,0,1,1,0,,0,0,,,,,,,,,,,,,,,,,,2,2,,1,0,2,2,2,1,,2,1,,,,,,,,,,,,,,,,,,4,10,,1,0,5,3,5,1,,5,4,,,,,,,,,,,,,,,,,,1,3,,1,1,3,2,1,2,,2,3,,,,,,,,,,,,,,,,,,3,3,,3,3,3,3,3,3,,3,3,,,,,,,,,,,,,,,,,,3,3,,3,3,3,3,3,3,,3,3,,,,,,,,,,,,,,,,,,3,3,,3,2,3,3,3,3,,3,3,,,,,,,,,,,,,,,,,,1,3,,1,1,2,3,2,3,,2,3,,,,,,,,,,,,,,,,,,,,,,,,,,,,,,,,,,,,,,,,,,,,,,,,,,,,,,,,,,,,,,,,,,,,,,,,,,,,,,,,,,,,,,,,,,,,,,,,,,,,,,,,,,,,,,,,,,,,,,,,,,,,,,,,,,,,,,,,,,,,,,,,,,,,,,,,,,,,,,,,,,,,,,,,,,,,,,,,,,,,,,,,,,,,,,,
12/27/2022 14:09,12/27/2022 14:19,100,558,TRUE,12/27/2022 14:19,R_1eXBmMVgUDBffff,32.7638,-117.07,gl,EN,"Yes, I consent",Biotech researcher,,<1, Translational Research,we are good at publish papers,Bottleneck:  Translational Research <br>Why: we are good at publish papers,[T2] Translation Gap,,,,,,,,,real metric to evaluate the biological age,"[S1] Validated Biomarkers
[+S1] Validated Biomarkers",Commercialization/Clinical translation (turning lab demonstrated interventions into therapies),,,1,2,5,500,"Calory restriction/dietary approaches,NAD targeting therapies,Senolytics,Sirtuin targeting therapies,Somatic reprogramming",,,,No,,,,,,,people is too obsessed in publishing papers,,,,,,,,,,,,,,,,,,,,,,,,,,,,,,,,,,,,,,,,,,,,,,,,,,,,,,,,,,,,,,,,,,,,,,,,,,,,,,,,,,,,,,,,,,,,,,,,,,,,,,,,,,,,,,,,,,,,,,,,,,,,,,,,,,,,,,,,,,,,,,,,,,,,,,,,,,,,,,,,,,,,,,,,,,,,,,,,,,,,,,,,,,,,,,,,,,,,,,,,,,,,,,,,,,,,,,,,,,,,,,,,,,,,,,,,,,,,1,,,,0,,,,0,1,0,,,,,,,,,,,,2,,,,0,,,,0,1,0,,,,,,,,,,,,5,,,,3,,,,10,2,10,,,,,,,,,,,,1,,,,1,,,,2,1,3,,,,,,,,,,,,1,,,,1,,,,1,1,1,,,,,,,,,,,,1,,,,2,,,,2,3,2,,,,,,,,,,,,1,,,,2,,,,2,3,1,,,,,,,,,,,,1,,,,1,,,,2,3,2,,,,,,,,,,,,,,,,
12/27/2022 11:56,12/27/2022 14:24,100,8904,TRUE,12/27/2022 14:24,R_1OpH6ja9me9Fd0w,42.3687,-71.0863,gl,EN,"Yes, I consent","Academic researcher (postdoc/PhD/MSc/BSc student),Other (specify)",delt4,20-Oct,gain of function experiments ,"not enough data on extended lifespan and correlated side effects (eg caloric restriction works in worms but they are less mobile and lethargic, prob immune compromised)","Bottleneck: gain of function experiments  <br>Why: not enough data on extended lifespan and correlated side effects (eg caloric restriction works in worms but they are less mobile and lethargic, prob immune compromised)",[S6] Misc,step wise organ wise extension of lifespan/functional span,"express telomerade eg in one tissue that is age limiting, then another, then another and show additive effect","Bottleneck: step wise organ wise extension of lifespan/functional span <br>Why: express telomerade eg in one tissue that is age limiting, then another, then another and show additive effect","[T2] Translation Gap
[+T4] Intervention Testing
[C14] Piecemeal Studies",current theories are nonsense except for antagonistic pleiotropy ,"we need equations or formulaic approaches. from protein damage, to dna damage, to ros to.wathever single.aspect we focus on, we lose 2 things: 1) the perspecti e thst aging integrated and 2) the side effects of tweaking single parameters. also i doubt an engineered organism that libes longer will have a chance to compete with wildtype in the wild. Its Evolution and natural selection baby.","Bottleneck: current theories are nonsense except for antagonistic pleiotropy  <br>Why: we need equations or formulaic approaches. from protein damage, to dna damage, to ros to.wathever single.aspect we focus on, we lose 2 things: 1) the perspecti e thst aging integrated and 2) the side effects of tweaking single parameters. also i doubt an engineered organism that libes longer will have a chance to compete with wildtype in the wild. Its Evolution and natural selection baby.","
[+X1.1] In Silico/Systems Aging Models
[S7] Systems Bio of Aging
[X1.3] Lack of In Silico/Systems Aging Models",Delt4 ,[+X8] AI Tools,Other (specify),delt4,"we need all-knowledge, pointed at yes/no questions and corresponding informed experiments",-5,0,50,"long enough to learn a little about the world, but the question is quality not quantity. 75-80y before losing physical fitness","Plasma/blood based therapies,Senolytics,Telomere extending therapies,Other 1 (specify),Other 2 (specify),Other 3 (specifiy)",pgc1a expression,stress r e duction,exercise,No,,,,,,,use antagonistic pleiotropy genes and knock them out in after breeding individuals for a short trip to succes. kindly mind offtissue intarget editing side effects,,,,,,,,,,,,,,,,,,,,,,,,,,,,,,,,,,,,,,,,,,,,,,,,,,,,,,,,,,,,,,,,,,,,,,,,,,,,,,,,,,,,,,,,,,,,,,,,,,,,,,,,,,,,,,,,,,,,,,,,,,,,,,,,,,,,,,,,,,,,,,,,,,,,,,,,,,,,,,,,,,,,,,,,,,,,,,,,,,,,,,,,,,,,,,,,,,,,,,,,,,,,,,,,,,,,,,,,,,,,,,,,,,,,,,,,,,,,,,,,,,,,,,,,,,,,,,,,,,,,,,,,,,,,,,,,,,,,,,,,,,,,,,,,,,,,,,,,,,,,,,,,,,,,,,,,,,,,,,,,,,,,,,,,,,,,,,,,,,,,,,,,,,,,,,,,,,,,,,,,,,,,,,,,,,,,,,,,,,,,,,,,,,,,,,,,,,,,,,,,,,,,,,,,,Unknown,,Neutral,0,0,,,not meaningful message
12/27/2022 11:33,12/27/2022 14:49,100,11795,TRUE,12/27/2022 14:49,R_3nAVyEUGoRW8Hqc,43.847,18.3856,gl,EN,"Yes, I consent","Data scientist/Software engineer,Entrepreneur",,3-Jan,Cheap and fast invivo testing,Not democratised access to both academics and commerical entities,Bottleneck: Cheap and fast invivo testing <br>Why: Not democratised access to both academics and commerical entities,"[X1.2] Slow & Expensive Models
[+X1.2] Ex vivo Models",Extensive computational approach ,You need to derive insights test hypothesise in the dry lab long before the wet one,Bottleneck: Extensive computational approach  <br>Why: You need to derive insights test hypothesise in the dry lab long before the wet one,"[+X1.1] In Silico/Systems Aging Models
[X12] Systems bio computation",FDA approved clinical proxies,"We need concrete aging clinical trials, right now its bypassed with other indications","Bottleneck: FDA approved clinical proxies <br>Why: We need concrete aging clinical trials, right now its bypassed with other indications","[S1] Validated Biomarkers
[+S1] Validated Biomarkers
[T1] Lack of Regulatory Path",Aging classified as a disease by FDA,"[+T1] Regulatory Path
[P2] Individual Disease Focus","Computational modeling (development of in silico aging models that can make useful predictions),Policy (governmental lobbying and policymaking on funding and healthcare changes to drive development of longevity interventions),Regulatory reform (shifting the FDA to an aging/longevity paradigm)",,,0,5,10,120,"Calory restriction/dietary approaches,Genetic medicine (gene therapies/editing)",,,,"Other 1 (specify),Other 2 (specify),Other 3 (specify)",ECM,Autophagy,Inflammation,,,,,0,0,0,,,,,,,,,,,,,,,,,,,,,,,,,,,5,5,5,,,,,,,,,,,,,,,,,,,,,,,,,,,10,10,10,,,,,,,,,,,,,,,,,,,,,,,,,,,3,3,3,,,,,,,,,,,,,,,,,,,,,,,,,,,3,3,3,,,,,,,,,,,,,,,,,,,,,,,,,,,3,3,3,,,,,,,,,,,,,,,,,,,,,,,,,,,3,3,3,,,,,,,,,,,,,,,,,,,,,,,,,,,3,3,3,,,,,,,,,,,,,,,,,,,,,,,,,,,,,,2,5,,,,,,,,,,,,,,,,,,,,,3,10,,,,,,,,,,,,,,,,,,,,,5,15,,,,,,,,,,,,,,,,,,,,,1,3,,,,,,,,,,,,,,,,,,,,,2,3,,,,,,,,,,,,,,,,,,,,,2,3,,,,,,,,,,,,,,,,,,,,,2,2,,,,,,,,,,,,,,,,,,,,,2,3,,,,,,,,,,,,,,,,,,,,,,,,,
12/27/2022 15:50,12/27/2022 16:02,100,754,TRUE,12/27/2022 16:02,R_2WYfyr69Y9fHsg0,38.7943,-123.0039,gl,EN,"Yes, I consent","Academic researcher (postdoc/PhD/MSc/BSc student),Principal investigator/Professor",,>20,Human Validation,,Bottleneck: Human Validation,[T2] Translation Gap,Limited government funding,,Bottleneck: Limited government funding,"[F2] for Basic Research
[+F2] for Basic Research","Awareness on the part of clinicians, regulators and general public",,"Bottleneck: Awareness on the part of clinicians, regulators and general public",[P1] Poorly Informed,Increased regulatory paths to getting longevity medicine to the market.,"[T1] Lack of Regulatory Path
[+T1] Regulatory Path","Commercialization/Clinical translation (turning lab demonstrated interventions into therapies),Outreach (building public support for longevity interventions),Policy (governmental lobbying and policymaking on funding and healthcare changes to drive development of longevity interventions)",,,2,5,10,As long as possible.,"Calory restriction/dietary approaches,NAD targeting therapies,Rapamycin supplementation,Sirtuin targeting therapies,Stem cell therapies,Other 1 (specify)",Natural products and repurposing drugs,,,,,,,,,,,,,,,,,,,,,,,,,,,,,,,,,,,,,,,,,,,,,,,,,,,,,,,,,,,,,,,,,,,,,,,,,,,,,,,,,,,,,,,,,,,,,,,,,,,,,,,,,,,,,,,,,,,,,,,,,,,,,,,,,,,,,,,,,,,,,,,,,,,,,,,,,,,,,,,,,,,,,,,,,,,,,,,,,,,,,,,,,,,,,,,,,,,,,,,,,,,,,,,,,,,,,,,,,,,,,,,,,,,,,,,,,,,,,,,,,,,3,,,,,,,,,,,,,,,,,,,,,,5,,,,,,,,,,5,,,,5,,,,,,,,10,,,,,,,,,,10,,,,10,,,,,,,,1,,,1,,,,2,,,3,,1,,3,,,,,,,,2,,,1,,,,1,,,2,,1,,2,,,,,,,,2,,,2,,,,2,,,2,,2,,2,,,,,,,,2,,,1,,,,2,,,2,,1,,2,,,,,,,,1,,,2,,,,1,,,2,,1,,2,,,,,,,,Unknown,,Neutral,0,0,,,other
12/27/2022 19:01,12/27/2022 19:08,100,435,TRUE,12/27/2022 19:08,R_2Cm2e4ETMqn59Po,30.2423,-97.7672,gl,EN,"Yes, I consent","Biotech researcher,Entrepreneur,Executive",,5-Mar,Clinical trials approval,,Bottleneck: Clinical trials approval,"[T1] Lack of Regulatory Path
",Path to market given today's regulatory environment,,Bottleneck: Path to market given today's regulatory environment,[T5] Market Failure,,,,,Either a special economic zone or a significant change in FDA policy allowing fundamental research in aging interventions to be clinically investigated,"[+T1] Regulatory Path
[+T3] Regulatory Opt-Out
[T1] Lack of Regulatory Path","Regulatory reform (shifting the FDA to an aging/longevity paradigm),Technology development (targeted solving of technological capability gaps)",,,-2,-5,-8,Infinity,"Calory restriction/dietary approaches,Genetic medicine (gene therapies/editing),Metformin supplementation,Microbiome replacement,NAD targeting therapies,Organ replacement,Plasma/blood based therapies,Rapamycin supplementation,Senolytics,Sirtuin targeting therapies,Somatic reprogramming,Stem cell therapies,Telomere extending therapies",,,,,,,,,,,,,,,,,,,,,,,,,,,,,,,,,,,,,,,,,,,,,,,,,,,,,,,,,,,,,,,,,,,,,,,,,,,,,,,,,,,,,,,,,,,,,,,,,,,,,,,,,,,,,,,,,,,,,,,,,,,,,,,,,,,,,,,,,,,,,,,,,,,,,,,,,,,,,,,,,,,,,,,,,,,,,,,,,,,,,,,,,,,,,,,,,,,,,,,,,,,,,,,,,,,,,,,,,,,,,,,,,,,,,,,,,,,,,,,,,,,,,,,0,2,2,2,2,0,2,2,2,2,2,2,2,,,,,,,,,,0,10,2,2,2,0,2,2,2,2,2,2,2,,,,,,,,,,0,25,22,2,2,0,2,2,2,2,2,2,2,,,,,,,,,,1,3,1,3,2,3,1,2,2,3,3,3,3,,,,,,,,,,1,3,1,3,2,3,3,1,2,2,2,3,2,,,,,,,,,,1,3,1,3,2,3,3,2,2,3,2,3,3,,,,,,,,,,1,3,1,3,2,3,3,2,2,2,2,3,3,,,,,,,,,,3,1,1,2,2,3,1,2,2,1,1,1,1,,,,,,,,,,,,,,
12/27/2022 19:42,12/27/2022 20:00,100,1043,TRUE,12/27/2022 20:00,R_e8WUgslG34dnzaN,37.8906,-122.2936,gl,EN,"Yes, I consent",Academic researcher (postdoc/PhD/MSc/BSc student),,10-May,Trained hands to work on projects,"Limited funding, federal and state pay caps for postdocs and graduate students, limited supply of interested students","Bottleneck: Trained hands to work on projects <br>Why: Limited funding, federal and state pay caps for postdocs and graduate students, limited supply of interested students","[H1] Career & Edu Paths
[H2] Low Pay
[H4] Top/Skilled Talent",Close-minded funding and reviewers limiting avenues of research,"The vast majority of aging research are variations on the same 3-4 topics in the same 3-5 systems; while the most radical breakthroughs are most likely to come from alternative, unexplored sources (non-model organisms, other white elephants), both public and private funders are reluctant to fund these lines of research.","Bottleneck: Close-minded funding and reviewers limiting avenues of research <br>Why: The vast majority of aging research are variations on the same 3-4 topics in the same 3-5 systems; while the most radical breakthroughs are most likely to come from alternative, unexplored sources (non-model organisms, other white elephants), both public and private funders are reluctant to fund these lines of research.","[F1] Too Conservative
[C11] Conservatism",Funding,A bottleneck as fundamental to science as aging is to biology. This is both for basic science funding as well as translational funding.,Bottleneck: Funding <br>Why: A bottleneck as fundamental to science as aging is to biology. This is both for basic science funding as well as translational funding.,"[F2] for Basic Research
[+F2] for Basic Research
[F6] for Translation
[+F6] for Translation","More organizations like Impetus that fund moonshot proposal ideas at all budgets, ideally with facility support included (like an incubator).","[F1] Too Conservative
[+F1] Ambitious/Exploratory
[+C7] New Research Centers","Outreach (building public support for longevity interventions),Policy (governmental lobbying and policymaking on funding and healthcare changes to drive development of longevity interventions),Other (specify)",Academic Research - NON-hypothesis driven science for discovery of novel hypotheses. ,"Public funding is overwhelmingly the largest current and potential source of funding for science - funding that is fundamental to all facets of aging research, basic and translational. Furthermore, while translational pipelines are vital, too much emphasis on them would lead to the suffocation of future research born from alternative, more radical research directions that have yet to be explored.",0,0,5,As long as entropically possible.,"Genetic medicine (gene therapies/editing),Sirtuin targeting therapies,Stem cell therapies,Telomere extending therapies",,,,"Microbiome replacement,Rapamycin supplementation,Senolytics",,,,,,,,,,,,,,,,,,,,,0,,,,5,0,,,,,,,,,,,,,,,,,,,,,,,,0,,,,5,10,,,,,,,,,,,,,,,,,,,,,,,,0,,,,5,10,,,,,,,,,,,,,,,,,,,,,,,,2,,,,3,3,,,,,,,,,,,,,,,,,,,,,,,,1,,,,1,2,,,,,,,,,,,,,,,,,,,,,,,,1,,,,1,2,,,,,,,,,,,,,,,,,,,,,,,,2,,,,1,3,,,,,,,,,,,,,,,,,,,,,,,,1,,,,1,3,,,,,,,,,,,,,,,0,,,,,,,,0,,0,0,,,,,,,,,,,0,,,,,,,,0,,5,0,,,,,,,,,,,75,,,,,,,,0,,10,0,,,,,,,,,,,3,,,,,,,,2,,3,1,,,,,,,,,,,3,,,,,,,,1,,2,1,,,,,,,,,,,2,,,,,,,,2,,2,2,,,,,,,,,,,1,,,,,,,,1,,1,1,,,,,,,,,,,3,,,,,,,,1,,2,1,,,,,,,,,,,,,,
