stems,,,,,,,,,,,,,,,Q2-Bottleneck1-Title,Q2-Bottleneck1-Why,Q2.1-Bottleneck,Q2.1 Tags,Q2-Bottleneck2-Title,Q2-Bottleneck2-Why,Q2.2-Bottleneck,Q2.2 Tags,Q2-Bottleneck3-Title,Q2-Bottleneck3-Why,Q2.2-Bottleneck,Q2.3 Tags,Q3-Solution,Q3 Tags,Investment,,,,,,,,,,,,,,,,,,,,,,,,,,,,,,,,,,,,,,,,,,,,,,,,,,,,,,,,,,,,,,,,,,,,,,,,,,,,,,,,,,,,,,,,,,,,,,,,,,,,,,,,,,,,,,,,,,,,,,,,,,,,,,,,,,,,,,,,,,,,,,,,,,,,,,,,,,,,,,,,,,,,,,,,,,,,,,,,,,,,,,,,,,,,,,,,,,,,,,,,,,,,,,,,,,,,,,,,,,,,,,,,,,,,,,,,,,,,,,,,,,,,,,,,,,,,,,,,,,,,,,,,,,,,,,,,,,,,,,,,,,,,,,,,,,,,,,,,,,,,,,,,,,,,,,,,,,,,,,,,,,,,,,,,,,,,,,,,,,,,,,,,,,,,,,,,,,,,,,,,,,,,,,,,,,,,,,,,,,,,,,,,,,,,,,,,,,,,,,,,,,,,,,,,,,,,,,,,,,,,,,,,,,,,,,,,,,
12/27/2022 11:05,1/2/2023 19:14,100,547705,TRUE,1/2/2023 19:14,R_3ekvQfHdtMNVvMZ,42.3514,-71.0421,gl,EN,"Yes, I consent","Academic researcher (postdoc/PhD/MSc/BSc student),Investor,Science communicator",,3-Jan,endpoints,time (hard to measure successful longevity interventions),Bottleneck: endpoints <br>Why: time (hard to measure successful longevity interventions),"[S1] Validated Biomarkers
[+S1] Validated Biomarkers
[T3] Slow/Expensive Trials
[X1.2] Slow & Expensive Models",tools,"delivery (potency, toxicity, specificity), precise editing","Bottleneck: tools <br>Why: delivery (potency, toxicity, specificity), precise editing",[X8] Gene Delivery,FDA recognition,need to consider aging as something worth / possible to treat,Bottleneck: FDA recognition <br>Why: need to consider aging as something worth / possible to treat,"[T1] Lack of Regulatory Path
[+T1] Regulatory Path
[P2] Individual Disease Focus",delivery tools ,[+X7] Gene Delivery,"Big Data collection (large scale, empirical - ex multiomic biobanks),Regulatory reform (shifting the FDA to an aging/longevity paradigm),Technology development (targeted solving of technological capability gaps)",,,5,15,25,200+,"Calory restriction/dietary approaches,Genetic medicine (gene therapies/editing)",,,,No,,,,,,,,,,,,,,,,,,,,,,,,,,,,,,,,,,,,,,,,,,,,,,,,,,,,,,,,,,,,,,,,,,,,,,,,,,,,,,,,,,,,,,,,,,,,,,,,,,,,,,,,,,,,,,,,,,,,,,,,,,,,,,,,,,,,,,,,,,,,,,,,,,,,,,,,,,,,,,,,,,,,,,,,,,,,,,,,,,,,,,,,,,,,,,,,,,,,,,,,,,,,,,,,,,,,,,,,,,,,,,,,,,,,,,,,,,,,,,,,,,,10,5,,,,,,,,,,,,,,,,,,,,,10,5,,,,,,,,,,,,,,,,,,,,,10,5,,,,,,,,,,,,,,,,,,,,,3,2,,,,,,,,,,,,,,,,,,,,,2,2,,,,,,,,,,,,,,,,,,,,,2,2,,,,,,,,,,,,,,,,,,,,,2,2,,,,,,,,,,,,,,,,,,,,,2,2,,,,,,,,,,,,,,,,,,,,,,,,,
12/28/2022 8:19,1/2/2023 19:17,100,471501,TRUE,1/2/2023 19:17,R_1ozjOqrnPHZiwLR,42.312,-71.1081,gl,EN,"Yes, I consent",Academic researcher (postdoc/PhD/MSc/BSc student),,>20,We need to the effect of natural genetic variation on response to putative interventions. ,"This is a major bottleneck, as there is less work on this problem, and so far has been little interest by NIH in funding this problem (though they are trying to ameliorate this problem). This is critically important--the few studies out there on genetic variation and interventions show that for *any* intervention known to increase lifespan, there are genotypes that either don't respond or response *negatively*. ","Bottleneck: We need to the effect of natural genetic variation on response to putative interventions.  <br>Why: This is a major bottleneck, as there is less work on this problem, and so far has been little interest by NIH in funding this problem (though they are trying to ameliorate this problem). This is critically important--the few studies out there on genetic variation and interventions show that for *any* intervention known to increase lifespan, there are genotypes that either don't respond or response *negatively*. ",[S5] Variation Mapping,Epidemiologists have identified environmental factors that can alter human lifespan by many years. The biology-focused geroscience community pays little attention to this. Biologists and epidemiologists/environmental risk experts need to work more closely together.,"Little support for cross-disciplinary work in this area, and historical lack of contact between molecular biologists and epidemiologists.","Bottleneck: Epidemiologists have identified environmental factors that can alter human lifespan by many years. The biology-focused geroscience community pays little attention to this. Biologists and epidemiologists/environmental risk experts need to work more closely together. <br>Why: Little support for cross-disciplinary work in this area, and historical lack of contact between molecular biologists and epidemiologists.","[C4] Lack of Collective Action
[C9] Insularity
[H8] Interdisciplinary",,,,,More funding.,[+F0] Overall More Funding,"Academic research (standard hypothesis driven science for publications),Big Data collection (large scale, empirical - ex multiomic biobanks),Computational modeling (development of in silico aging models that can make useful predictions)",,"Aging is very much a complex systems problem, and computational resources & approaches are key.",1,3,8,95,Calory restriction/dietary approaches,,,,No,,,,,,,"We see dramatic differences in healthy lifespan between different regions of the US. These environmental/epidemiological factors are generally ignored in the geroscience/biology of aging community, as is natural genetic variation. This failure to fully appreciate the importance of natural genetic and environmental variation is a serious shortcoming in geroscience.",,,,,,,,,,,,,,,,,,,,,,,,,,,,,,,,,,,,,,,,,,,,,,,,,,,,,,,,,,,,,,,,,,,,,,,,,,,,,,,,,,,,,,,,,,,,,,,,,,,,,,,,,,,,,,,,,,,,,,,,,,,,,,,,,,,,,,,,,,,,,,,,,,,,,,,,,,,,,,,,,,,,,,,,,,,,,,,,,,,,,,,,,,,,,,,,,,,,,,,,,,,,,,,,,,,,,,,,,,,,,,,,,,,,,,,,,,,,3,,,,,,,,,,,,,,,,,,,,,,3,,,,,,,,,,,,,,,,,,,,,,3,,,,,,,,,,,,,,,,,,,,,,1,,,,,,,,,,,,,,,,,,,,,,3,,,,,,,,,,,,,,,,,,,,,,1,,,,,,,,,,,,,,,,,,,,,,1,,,,,,,,,,,,,,,,,,,,,,2,,,,,,,,,,,,,,,,,,,,,,,,,,
1/2/2023 19:10,1/2/2023 19:23,100,743,TRUE,1/2/2023 19:23,R_yVfycfcfGjkBT7X,40.8123,-73.9682,gl,EN,"Yes, I consent",Academic researcher (postdoc/PhD/MSc/BSc student),,10-May,personnel with dual expertise (or interest in developing such) in computational biology and epidemiology,not sure. could be that biotech is sucking up all the postdocs. could be that there is just not enough comp bio expertise in api-oriented PhDs ,Bottleneck: personnel with dual expertise (or interest in developing such) in computational biology and epidemiology <br>Why: not sure. could be that biotech is sucking up all the postdocs. could be that there is just not enough comp bio expertise in api-oriented PhDs ,"[H3] Quantitative
[+H1] Quantitative
[H8] Interdisciplinary
[+H5] Interdisciplinary",longitudinal biological data on large samples of humans,there are too few public-domain datasets that observe the natural course of human aging in large numbers of individuals. there are a number of datasets that could help us make rapid progress. but they are closely held and accessing them is intensely bureaucratic and time consuming. ,Bottleneck: longitudinal biological data on large samples of humans <br>Why: there are too few public-domain datasets that observe the natural course of human aging in large numbers of individuals. there are a number of datasets that could help us make rapid progress. but they are closely held and accessing them is intensely bureaucratic and time consuming. ,"[X2] Public Datasets
[S3] Longitudinal Data/Samples
[S2] Aging Characterization
[C10] Siloing / Secrecy",,,,,"streamlining access to the series large scale publicly funded longitudinal studies initiated by NHLBI and currently supported primarily by NIA (ARIC, CARDIA, MESA, CHS, Jackson Heart Study, Strong Heart Study, Bogalusa Heart Study)","[+X2] Public Datasets
[+S3] Longitudinal Data/Samples","Academic research (standard hypothesis driven science for publications),Big Data collection (large scale, empirical - ex multiomic biobanks),Computational modeling (development of in silico aging models that can make useful predictions)",,"We don't yet know enough about how to measure or model human aging to make rapid advances toward therapeutics. generating concrete knowledge of what human aging looks like (natural course, extent of variation) + how it is modified by existing behavioral and drug interventions is a precondition to designing strong RCTs of next-gen anti-aging therapies",1,2,5,forever,Calory restriction/dietary approaches,,,,"Metformin supplementation,Rapamycin supplementation",,,,,,,,,,,,,,,,,,,,0,,,,,0,,,,,,,,,,,,,,,,,,,,,,,,5,,,,,0,,,,,,,,,,,,,,,,,,,,,,,,5,,,,,10,,,,,,,,,,,,,,,,,,,,,,,,2,,,,,3,,,,,,,,,,,,,,,,,,,,,,,,3,,,,,3,,,,,,,,,,,,,,,,,,,,,,,,1,,,,,2,,,,,,,,,,,,,,,,,,,,,,,,2,,,,,2,,,,,,,,,,,,,,,,,,,,,,,,2,,,,,2,,,,,,,,,,,,,,,0,,,,,,,,,,,,,,,,,,,,,,0,,,,,,,,,,,,,,,,,,,,,,0,,,,,,,,,,,,,,,,,,,,,,,,,,,,,,,,,,,,,,,,,,,,,,,,,,,,,,,,,,,,,,,,,,,,,,,,,,,,,,,,,,,,,,,,,,,,,,,,,,,,,,,,,,,,,,,,,,,,,,,,,,,,,,,,,,,,,,,,
12/27/2022 15:15,1/2/2023 19:24,100,533330,TRUE,1/2/2023 19:24,R_3RvGpRxMZAA1Uek,37.7595,-122.4367,gl,EN,"Yes, I consent",Academic researcher (postdoc/PhD/MSc/BSc student),,5-Mar,mindset,My position in the field is quite unique as I propose a model that contradicts the mainstream ideas that most people believe. I think our arguments are the strongest but somehow people think that finding the exact nature of aging is less important than doing blind drug screens and omics. <br><br>I am not sure my case is representative. ,Bottleneck: mindset <br>Why: My position in the field is quite unique as I propose a model that contradicts the mainstream ideas that most people believe. I think our arguments are the strongest but somehow people think that finding the exact nature of aging is less important than doing blind drug screens and omics. <br><br>I am not sure my case is representative. ,"[C5] Consensus Aging Definitions
[S9] Aging Mechanisms
[C11] Conservatism
",,,,,,,,,,,"Academic research (standard hypothesis driven science for publications),Big Data collection (large scale, empirical - ex multiomic biobanks),Computational modeling (development of in silico aging models that can make useful predictions)",,,0,0,0,forever,,,,,No,,,,,,,,,,,,,,,,,,,,,,,,,,,,,,,,,,,,,,,,,,,,,,,,,,,,,,,,,,,,,,,,,,,,,,,,,,,,,,,,,,,,,,,,,,,,,,,,,,,,,,,,,,,,,,,,,,,,,,,,,,,,,,,,,,,,,,,,,,,,,,,,,,,,,,,,,,,,,,,,,,,,,,,,,,,,,,,,,,,,,,,,,,,,,,,,,,,,,,,,,,,,,,,,,,,,,,,,,,,,,,,,,,,,,,,,,,,,,,,,,,,,,,,,,,,,,,,,,,,,,,,,,,,,,,,,,,,,,,,,,,,,,,,,,,,,,,,,,,,,,,,,,,,,,,,,,,,,,,,,,,,,,,,,,,,,,,,,,,,,,,,,,,,,,,,,,,,,,,,,,,,,,,,,,,,,,,,,,,,,,,,,,,,,,,,,,,,,,,,,,,,,,,,,,,,,,,,,,,,,,,,
1/2/2023 19:23,1/2/2023 19:27,100,235,TRUE,1/2/2023 19:27,R_2DP7GFOalsUwjuB,30.5478,-96.2715,gl,EN,"Yes, I consent",Academic researcher (postdoc/PhD/MSc/BSc student),,20-Oct,Participant recruitment,,Bottleneck: Participant recruitment,[T6] Participant Recruitment,attaining funding,,Bottleneck: attaining funding,"[F0] Overall Lack of Funding
[+F0] Overall More Funding",,,,,"Broader research participant databases -- I work in human neuroimaging. It takes a lot of time and work to find eligible participants. We are building our own database locally, but it has been hugely challenging.",[+T2] Participant Database,"Academic research (standard hypothesis driven science for publications),Big Data collection (large scale, empirical - ex multiomic biobanks),Policy (governmental lobbying and policymaking on funding and healthcare changes to drive development of longevity interventions)",,,0,2,3,"Until health and quality of life decline substantially -- ideally, into my 90s","Calory restriction/dietary approaches,Genetic medicine (gene therapies/editing),Sirtuin targeting therapies",,,,No,,,,,,,,,,,,,,,,,,,,,,,,,,,,,,,,,,,,,,,,,,,,,,,,,,,,,,,,,,,,,,,,,,,,,,,,,,,,,,,,,,,,,,,,,,,,,,,,,,,,,,,,,,,,,,,,,,,,,,,,,,,,,,,,,,,,,,,,,,,,,,,,,,,,,,,,,,,,,,,,,,,,,,,,,,,,,,,,,,,,,,,,,,,,,,,,,,,,,,,,,,,,,,,,,,,,,,,,,,,,,,,,,,,,,,,,,,,,,,,,,,,,,,,,,,,,,,,,,,,,,,,,,,,,,,,,,,,,,,,,,,,,,,,,,,,,,,,,,,,,,,,,,,,,,,,,,,,,,,,,,,,,,,,,,,,,,,,,,,,,,,,,,,,,,,,,,,,,,,,,,,,,,,,,,,,,,,,,,,,,,,,,,,,,,,,,,,,,,,,,,,,,,,,,,,,,,,,,,,,,,,,
1/2/2023 19:16,1/2/2023 19:27,100,675,TRUE,1/2/2023 19:27,R_2uKtM3FfPr0E5la,29.7738,-95.406,gl,EN,"Yes, I consent",Academic researcher (postdoc/PhD/MSc/BSc student),,5-Mar,lack of sufficient money for research,,Bottleneck: lack of sufficient money for research,[F2] for Basic Research,proper animal model,,Bottleneck: proper animal model,"
[X1.1] Lack of Predictive Models

[+X1.4] Unspecified/Misc Models",lab communication around the world,,Bottleneck: lab communication around the world,"[C3] Networking
[+C3] Networking",resource ,[+F2] for Basic Research,Academic research (standard hypothesis driven science for publications),,discovery is the only way to identify aging mechanism or preventing mechanism. Research is the only way of discovery,10,10,15,90,Telomere extending therapies,,,,Plasma/blood based therapies,,,,,,,we need a big international meeting instead of multi small meeting about aging,,,,,,,,,,,,,,,,,0,,,,,,,,,,,,,,,,,,,,,,,,,,,,,5,,,,,,,,,,,,,,,,,,,,,,,,,,,,,10,,,,,,,,,,,,,,,,,,,,,,,,,,,,,3,,,,,,,,,,,,,,,,,,,,,,,,,,,,,2,,,,,,,,,,,,,,,,,,,,,,,,,,,,,2,,,,,,,,,,,,,,,,,,,,,,,,,,,,,1,,,,,,,,,,,,,,,,,,,,,,,,,,,,,2,,,,,,,,,,,,,,,,,,,,,,,,,,,,0,,,,,,,,,,,,,,,,,,,,,,10,,,,,,,,,,,,,,,,,,,,,,20,,,,,,,,,,,,,,,,,,,,,,2,,,,,,,,,,,,,,,,,,,,,,3,,,,,,,,,,,,,,,,,,,,,,2,,,,,,,,,,,,,,,,,,,,,,3,,,,,,,,,,,,,,,,,,,,,,3,,,,,,,,,,,,,,
1/2/2023 20:16,1/2/2023 20:23,100,445,TRUE,1/2/2023 20:23,R_2zPiCwyF0XycQf6,35.7965,-78.7981,gl,EN,"Yes, I consent",Academic researcher (postdoc/PhD/MSc/BSc student),,<1,,,,,,,,,,,,,,,"Big Data collection (large scale, empirical - ex multiomic biobanks),Computational modeling (development of in silico aging models that can make useful predictions),Technology development (targeted solving of technological capability gaps)",,We currently lack the tools to measure/predict biological systems at the level we need,1,1,10,"All else equal, as long as possible",,,,,"Calory restriction/dietary approaches,Organ replacement,Somatic reprogramming",,,,,,,,,,,,,,,,,,0,,,,,0,,,,,1,,,,,,,,,,,,,,,,,,,0,,,,,2,,,,,1,,,,,,,,,,,,,,,,,,,1,,,,,5,,,,,10,,,,,,,,,,,,,,,,,,,1,,,,,2,,,,,1,,,,,,,,,,,,,,,,,,,1,,,,,2,,,,,2,,,,,,,,,,,,,,,,,,,1,,,,,2,,,,,2,,,,,,,,,,,,,,,,,,,1,,,,,2,,,,,2,,,,,,,,,,,,,,,,,,,1,,,,,3,,,,,2,,,,,,,,,,,,,,,,,,,,,,,,,,,,,,,,,,,,,,,,,,,,,,,,,,,,,,,,,,,,,,,,,,,,,,,,,,,,,,,,,,,,,,,,,,,,,,,,,,,,,,,,,,,,,,,,,,,,,,,,,,,,,,,,,,,,,,,,,,,,,,,,,,,,,,,,,,,,,,,,,,,,,,,,,,,,,,,,,,,,,,,,,,,,,,,,
1/2/2023 19:30,1/2/2023 20:24,100,3233,TRUE,1/2/2023 20:24,R_AnSKVTUu7yrX5S1,43.0729,-70.8052,gl,EN,"Yes, I consent",Biotech researcher,,5-Mar,,,,,,,,,,,,,,,,,,,,,,,,,,"Genetic medicine (gene therapies/editing),Organ replacement,Plasma/blood based therapies",,,,,,,,,,,,,,,,,,,0,,,,2,5,,,,,,,,,,,,,,,,,,,,,,,,5,,,,5,5,,,,,,,,,,,,,,,,,,,,,,,,15,,,,20,15,,,,,,,,,,,,,,,,,,,,,,,,3,,,,3,3,,,,,,,,,,,,,,,,,,,,,,,,1,,,,1,1,,,,,,,,,,,,,,,,,,,,,,,,1,,,,3,1,,,,,,,,,,,,,,,,,,,,,,,,2,,,,3,2,,,,,,,,,,,,,,,,,,,,,,,,2,,,,2,2,,,,,,,,,,,,,,,,,,,,,,,,,,,,,,,,,,,,,,,,,,,,,,,,,,,,,,,,,,,,,,,,,,,,,,,,,,,,,,,,,,,,,,,,,,,,,,,,,,,,,,,,,,,,,,,,,,,,,,,,,,,,,,,,,,,,,,,,,,,,,,,,,,,,,,,,,,,,,,,,,,,,,,,,,,,,,,,,,,,,,,,,,,,,,,,,,,,,
1/2/2023 19:18,1/2/2023 20:31,100,4413,TRUE,1/2/2023 20:31,R_1lnty1uQqHkTU0P,42.3737,-71.1284,gl,EN,"Yes, I consent",Academic researcher (postdoc/PhD/MSc/BSc student),,5-Mar,Time in cell culture,Limiting factor for testing a large number of experimental conditions,Bottleneck: Time in cell culture <br>Why: Limiting factor for testing a large number of experimental conditions,"
[X1.2] Slow & Expensive Models","Limited foundational knowledge, especially in a structured and centralized format",,"Bottleneck: Limited foundational knowledge, especially in a structured and centralized format","[X2] Public Datasets
[C2] Ad-hoc Data / Protocols
[S9] Aging Mechanisms",Cheap access to aged animals,,Bottleneck: Cheap access to aged animals,"[X4] Aged Animals/Tissues
[+X5] Aged Animals/Tissue Bank",searchable and structured knowledge base for raw literature data,"[+X2] Public Datasets
[+C2] Data/Protocol Standards","Computational modeling (development of in silico aging models that can make useful predictions),Policy (governmental lobbying and policymaking on funding and healthcare changes to drive development of longevity interventions),Technology development (targeted solving of technological capability gaps)",,,0,2,8,"No limit, indefinitely","Genetic medicine (gene therapies/editing),Somatic reprogramming,Stem cell therapies",,,,Microbiome replacement,,,,,,,Organ replacement and cryopreservation are underfunded with high potential for extending healthy life years,,,,,,,,,,,,,,0,,,,,,,,,,,,,,,,,,,,,,,,,,,,,0,,,,,,,,,,,,,,,,,,,,,,,,,,,,,1,,,,,,,,,,,,,,,,,,,,,,,,,,,,,,,,,,,,,,,,,,,,,,,,,,,,,,,,,,,,,,,,,,,,,,,,,,,,,,,,,,,,,,,,,,,,,,,,,,,,,,,,,,,,,,,,,,,,,,,,,,,,,,,,,,,,,,,,,,,,,,,,,,,,,,,,,,,,,,,,,,,,,0,,,,,,,,,0,0,,,,,,,,,,,,1,,,,,,,,,0,1,,,,,,,,,,,,2,,,,,,,,,0,3,,,,,,,,,,,,2,,,,,,,,,3,2,,,,,,,,,,,,2,,,,,,,,,2,2,,,,,,,,,,,,1,,,,,,,,,1,1,,,,,,,,,,,,2,,,,,,,,,1,2,,,,,,,,,,,,1,,,,,,,,,1,1,,,,,,,,,,,,,,,
1/2/2023 20:24,1/2/2023 20:49,100,1478,TRUE,1/2/2023 20:49,R_0eWWxCKNONU7xo5,37.751,-97.822,gl,EN,"Yes, I consent",Entrepreneur,,3-Jan,Research in Aging is siloed. ,Funding is in deep novel science,Bottleneck: Research in Aging is siloed.  <br>Why: Funding is in deep novel science,[C10] Siloing / Secrecy,Return On Investment analysis are few is any,Real world data takes time. Suggest simulating results and forecast ? ,Bottleneck: Return On Investment analysis are few is any <br>Why: Real world data takes time. Suggest simulating results and forecast ? ,"[C13] Entry Barriers/Orientation
[X0] Lack of Misc Tools/Tech",Catching Public Imagination. ,"Requires lay person terms to educate and create concerted and coordinated media, policy and gov outreach","Bottleneck: Catching Public Imagination.  <br>Why: Requires lay person terms to educate and create concerted and coordinated media, policy and gov outreach","[P6] Indifference

[+P1.1] Outreach to Public",???,,"Media (disseminating information),Outreach (building public support for longevity interventions),Policy (governmental lobbying and policymaking on funding and healthcare changes to drive development of longevity interventions)",,,5,10,25,100,Calory restriction/dietary approaches,,,,,,,,,,,Good survey. Good luck. ,,,,,,,,,,,,,,,,,,,,,,,,,,,,,,,,,,,,,,,,,,,,,,,,,,,,,,,,,,,,,,,,,,,,,,,,,,,,,,,,,,,,,,,,,,,,,,,,,,,,,,,,,,,,,,,,,,,,,,,,,,,,,,,,,,,,,,,,,,,,,,,,,,,,,,,,,,,,,,,,,,,,,,,,,,,,,,,,,,,,,,,,,,,,,,,,,,,,,,,,,,,,,,,,,,,,,,,,,,,,,,,,,,,,,,,,,,,,2,,,,,,,,,,,,,,,,,,,,,,4,,,,,,,,,,,,,,,,,,,,,,8,,,,,,,,,,,,,,,,,,,,,,,,,,,,,,,,,,,,,,,,,,,,3,,,,,,,,,,,,,,,,,,,,,,,,,,,,,,,,,,,,,,,,,,,,,,,,,,,,,,,,,,,,,,,,,,3,,,,,,,,,,,,,,,,,,,,,,,,,,
12/30/2022 15:34,1/2/2023 21:11,100,279428,TRUE,1/2/2023 21:11,R_4GXvmNETY80wuLD,37.7771,-122.406,gl,EN,"Yes, I consent",Investor,,<1,Ability to digest and understand the science,"Don't come from a science background, big learning curve","Bottleneck: Ability to digest and understand the science <br>Why: Don't come from a science background, big learning curve","[H1] Career & Edu Paths
[C13] Entry Barriers/Orientation","As an investor, the lack of an aging indication for FDA approval limits the scale/speed of development",,"Bottleneck: As an investor, the lack of an aging indication for FDA approval limits the scale/speed of development","[T1] Lack of Regulatory Path
[P2] Individual Disease Focus",,,,,Acceptance of aging as an indication for FDA clinical trials,[+T1] Regulatory Path,"Commercialization/Clinical translation (turning lab demonstrated interventions into therapies),Media (disseminating information),Regulatory reform (shifting the FDA to an aging/longevity paradigm)",,,2,5,12,200,,,,,,,,,,,,,,,,,,,,,,,,,,,,,,,,,,,,,,,,,,,,,,,,,,,,,,,,,,,,,,,,,,,,,,,,,,,,,,,,,,,,,,,,,,,,,,,,,,,,,,,,,,,,,,,,,,,,,,,,,,,,,,,,,,,,,,,,,,,,,,,,,,,,,,,,,,,,,,,,,,,,,,,,,,,,,,,,,,,,,,,,,,,,,,,,,,,,,,,,,,,,,,,,,,,,,,,,,,,,,,,,,,,,,,,,,,,,,,,,,,,,,,,,,,,,,,,,,,,,,,,,,,,,,,,,,,,,,,,,,,,,,,,,,,,,,,,,,,,,,,,,,,,,,,,,,,,,,,,,,,,,,,,,,,,,,,,,,,,,,,,,,,,,,,,,,,,,,,,,,,,,,,,,,,,,,,,,,,,,,,,,,,,,,,,,,,,,,,,,,,,,,,,,,,,,,,,,,,,,,,,,,,,,
1/2/2023 19:16,1/2/2023 23:16,100,14387,TRUE,1/2/2023 23:16,R_2q1zO1tgR0WFlk0,42.3388,-71.0726,gl,EN,"Yes, I consent",Entrepreneur,,5-Mar,,,,,,,,,,,,,,,"Big Data collection (large scale, empirical - ex multiomic biobanks),Commercialization/Clinical translation (turning lab demonstrated interventions into therapies),Computational modeling (development of in silico aging models that can make useful predictions)",,"Gaps could be full filed if we combined mvel technology development, well organized data collection and targeted clinical trials and create predictive modeling to bitch u errata s all systematic causes of aging and ethically and safely manipulate the vectors for a longer life where desired. ",2,5,15,99,"Calory restriction/dietary approaches,Genetic medicine (gene therapies/editing),Microbiome replacement,Plasma/blood based therapies,Senolytics,Stem cell therapies",,,,No,,,,,,,This survey is above my pay grade as I don't understand or follow many of the methodologies. Would love to expand this survey to include the non-profit ( B-Corp) versus CVCs and Capital markets' objectives and needs / gaps. This survey is you science and research or Hig data focused ,,,,,,,,,,,,,,,,,,,,,,,,,,,,,,,,,,,,,,,,,,,,,,,,,,,,,,,,,,,,,,,,,,,,,,,,,,,,,,,,,,,,,,,,,,,,,,,,,,,,,,,,,,,,,,,,,,,,,,,,,,,,,,,,,,,,,,,,,,,,,,,,,,,,,,,,,,,,,,,,,,,,,,,,,,,,,,,,,,,,,,,,,,,,,,,,,,,,,,,,,,,,,,,,,,,,,,,,,,,,,,,,,,,,,,,,,,,,1,1,,1,,,1,,1,,,1,,,,,,,,,,,2,3,,3,,,2,,3,,,3,,,,,,,,,,,6,8,,7,,,6,,5,,,7,,,,,,,,,,,1,2,,2,,,3,,2,,,3,,,,,,,,,,,1,2,,3,,,2,,3,,,2,,,,,,,,,,,2,1,,3,,,2,,3,,,2,,,,,,,,,,,3,2,,3,,,2,,3,,,2,,,,,,,,,,,1,2,,1,,,3,,1,,,2,,,,,,,,,,,,,,,
